{
  "$schema": "https://raw.githubusercontent.com/mfmayer/gosk/main/api/json-schema/function-schema-v01.json",
  "name": "Joke",
  "description": "Generate a funny joke",
  "generator": {
    "name": "gpt35,default",
    "max_tokens": 1000,
    "temperature": 0.9,
    "top_p": 0.0,
    "presence_penalty": 0.0,
    "frequency_penalty": 0.0
  },
  "parameters": {
    "data": {
      "description": "Joke subject",
      "defaultValue": ""
    },
    "style": {
      "description": "Joke style",
      "defaultValue": ""
    }
  }
}